{
  "BrokerNodeGroupInfo": "example-value",
  "ClientAuthentication": "example-value",
  "ConfigurationInfo": "example-value",
  "EncryptionInfo": "example-value",
  "EnhancedMonitoring": "example-value",
  "OpenMonitoring": "example-value",
  "KafkaVersion": "example-value",
  "LoggingInfo": "example-value",
  "NumberOfBrokerNodes": "example-value",
  "StorageMode": "example-value"
}